AI Recommendation Robustness and Ground Truth Evaluation Report
====================================================================================================

Per Control Metrics (Iterations as table):
----------------------------------------------------------------------------------------------------
Control ID: 148
Iteration | cosine_tfidf | rouge_l_f1 | bleu | structural_similarity | bertscore_f1 | precision | recall | f1 | true_positives | gt_count | ai_claims | matched_ai_claims
-------------------------------------------------------------------------------------------------------------------------------------------------------------------------
1.0        | 0.386 | 0.173 | 0.029 | 0.606 | 0.193 | 0.500 | 0.200 | 0.286 | 2 | 10 | 4 | 2
2.0        | 0.373 | 0.188 | 0.029 | 0.643 | 0.174 | 0.000 | 0.000 | 0.000 | 0 | 10 | 3 | 0
3.0        | 0.433 | 0.225 | 0.028 | 0.658 | 0.203 | 0.250 | 0.100 | 0.143 | 1 | 10 | 4 | 1
4.0        | 0.392 | 0.211 | 0.028 | 0.537 | 0.161 | 0.000 | 0.000 | 0.000 | 0 | 10 | 3 | 0
5.0        | 0.464 | 0.239 | 0.039 | 0.576 | 0.207 | 0.000 | 0.000 | 0.000 | 0 | 10 | 3 | 0
6.0        | 0.417 | 0.204 | 0.026 | 0.679 | 0.173 | 0.400 | 0.200 | 0.267 | 2 | 10 | 5 | 2
7.0        | 0.450 | 0.225 | 0.039 | 0.630 | 0.210 | 0.250 | 0.100 | 0.143 | 1 | 10 | 4 | 1
8.0        | 0.419 | 0.213 | 0.025 | 0.619 | 0.189 | 0.500 | 0.200 | 0.286 | 2 | 10 | 4 | 2
9.0        | 0.435 | 0.210 | 0.042 | 0.655 | 0.218 | 0.333 | 0.100 | 0.154 | 1 | 10 | 3 | 1
10.0        | 0.395 | 0.186 | 0.054 | 0.563 | 0.193 | 0.200 | 0.100 | 0.133 | 1 | 10 | 5 | 1

Control ID: 149
Iteration | cosine_tfidf | rouge_l_f1 | bleu | structural_similarity | bertscore_f1 | precision | recall | f1 | true_positives | gt_count | ai_claims | matched_ai_claims
-------------------------------------------------------------------------------------------------------------------------------------------------------------------------
1.0        | 0.101 | 0.088 | 0.004 | 0.328 | -0.114 | 0.000 | 0.000 | 0.000 | 0 | 5 | 3 | 0
2.0        | 0.187 | 0.155 | 0.006 | 0.435 | 0.002 | 0.167 | 0.200 | 0.182 | 1 | 5 | 6 | 1
3.0        | 0.097 | 0.091 | 0.004 | 0.381 | -0.076 | 0.000 | 0.000 | 0.000 | 0 | 5 | 5 | 0
4.0        | 0.141 | 0.103 | 0.005 | 0.382 | -0.170 | 0.000 | 0.000 | 0.000 | 0 | 5 | 4 | 0
5.0        | 0.112 | 0.123 | 0.004 | 0.408 | -0.074 | 0.000 | 0.000 | 0.000 | 0 | 5 | 5 | 0
6.0        | 0.089 | 0.132 | 0.006 | 0.417 | 0.043 | 0.000 | 0.000 | 0.000 | 0 | 5 | 4 | 0
7.0        | 0.117 | 0.098 | 0.004 | 0.292 | -0.064 | 0.000 | 0.000 | 0.000 | 0 | 5 | 3 | 0
8.0        | 0.109 | 0.106 | 0.006 | 0.368 | -0.042 | 0.000 | 0.000 | 0.000 | 0 | 5 | 4 | 0
9.0        | 0.122 | 0.132 | 0.007 | 0.396 | 0.019 | 0.000 | 0.000 | 0.000 | 0 | 5 | 4 | 0
10.0        | 0.100 | 0.092 | 0.005 | 0.392 | -0.060 | 0.000 | 0.000 | 0.000 | 0 | 5 | 4 | 0

Control ID: 150
Iteration | cosine_tfidf | rouge_l_f1 | bleu | structural_similarity | bertscore_f1 | precision | recall | f1 | true_positives | gt_count | ai_claims | matched_ai_claims
-------------------------------------------------------------------------------------------------------------------------------------------------------------------------
1.0        | 0.355 | 0.248 | 0.019 | 0.463 | 0.094 | 0.000 | 0.000 | 0.000 | 0 | 4 | 4 | 0
2.0        | 0.278 | 0.162 | 0.022 | 0.518 | 0.031 | 0.000 | 0.000 | 0.000 | 0 | 4 | 4 | 0
3.0        | 0.335 | 0.167 | 0.023 | 0.546 | 0.048 | 0.000 | 0.000 | 0.000 | 0 | 4 | 5 | 0
4.0        | 0.270 | 0.187 | 0.018 | 0.472 | 0.112 | 0.000 | 0.000 | 0.000 | 0 | 4 | 4 | 0
5.0        | 0.305 | 0.192 | 0.018 | 0.538 | 0.020 | 0.000 | 0.000 | 0.000 | 0 | 4 | 4 | 0
6.0        | 0.291 | 0.175 | 0.016 | 0.472 | 0.060 | 0.000 | 0.000 | 0.000 | 0 | 4 | 6 | 0
7.0        | 0.341 | 0.203 | 0.018 | 0.548 | 0.137 | 0.000 | 0.000 | 0.000 | 0 | 4 | 4 | 0
8.0        | 0.289 | 0.150 | 0.028 | 0.464 | 0.063 | 0.000 | 0.000 | 0.000 | 0 | 4 | 4 | 0
9.0        | 0.329 | 0.145 | 0.022 | 0.474 | 0.035 | 0.000 | 0.000 | 0.000 | 0 | 4 | 6 | 0
10.0        | 0.229 | 0.183 | 0.017 | 0.491 | 0.100 | 0.000 | 0.000 | 0.000 | 0 | 4 | 5 | 0

Control ID: 151
Iteration | cosine_tfidf | rouge_l_f1 | bleu | structural_similarity | bertscore_f1 | precision | recall | f1 | true_positives | gt_count | ai_claims | matched_ai_claims
-------------------------------------------------------------------------------------------------------------------------------------------------------------------------
1.0        | 0.163 | 0.180 | 0.006 | 0.503 | 0.006 | 0.000 | 0.000 | 0.000 | 0 | 10 | 4 | 0
2.0        | 0.158 | 0.137 | 0.006 | 0.526 | 0.017 | 0.000 | 0.000 | 0.000 | 0 | 10 | 4 | 0
3.0        | 0.132 | 0.119 | 0.010 | 0.434 | -0.085 | 0.000 | 0.000 | 0.000 | 0 | 10 | 5 | 0
4.0        | 0.060 | 0.088 | 0.000 | 0.443 | 0.003 | 0.000 | 0.000 | 0.000 | 0 | 10 | 1 | 0
5.0        | 0.172 | 0.190 | 0.006 | 0.533 | 0.045 | 0.000 | 0.000 | 0.000 | 0 | 10 | 4 | 0
6.0        | 0.163 | 0.190 | 0.006 | 0.516 | -0.044 | 0.000 | 0.000 | 0.000 | 0 | 10 | 4 | 0
7.0        | 0.163 | 0.158 | 0.012 | 0.460 | 0.035 | 0.000 | 0.000 | 0.000 | 0 | 10 | 4 | 0
8.0        | 0.062 | 0.066 | 0.000 | 0.301 | -0.058 | 0.000 | 0.000 | 0.000 | 0 | 10 | 2 | 0
9.0        | 0.174 | 0.174 | 0.006 | 0.584 | 0.041 | 0.000 | 0.000 | 0.000 | 0 | 10 | 4 | 0
10.0        | 0.192 | 0.151 | 0.006 | 0.484 | -0.070 | 0.000 | 0.000 | 0.000 | 0 | 10 | 9 | 0

Control ID: 152
Iteration | cosine_tfidf | rouge_l_f1 | bleu | structural_similarity | bertscore_f1 | precision | recall | f1 | true_positives | gt_count | ai_claims | matched_ai_claims
-------------------------------------------------------------------------------------------------------------------------------------------------------------------------
1.0        | 0.116 | 0.141 | 0.004 | 0.481 | 0.059 | 0.500 | 0.200 | 0.286 | 2 | 10 | 4 | 1
2.0        | 0.174 | 0.156 | 0.005 | 0.460 | 0.009 | 0.000 | 0.000 | 0.000 | 0 | 10 | 3 | 0
3.0        | 0.130 | 0.131 | 0.005 | 0.486 | 0.001 | 0.500 | 0.200 | 0.286 | 2 | 10 | 4 | 1
4.0        | 0.098 | 0.107 | 0.004 | 0.446 | -0.052 | 0.000 | 0.000 | 0.000 | 0 | 10 | 3 | 0
5.0        | 0.116 | 0.108 | 0.008 | 0.385 | -0.055 | 0.000 | 0.000 | 0.000 | 0 | 10 | 4 | 0
6.0        | 0.138 | 0.101 | 0.002 | 0.557 | -0.008 | 1.000 | 0.200 | 0.333 | 2 | 10 | 2 | 1
7.0        | 0.117 | 0.113 | 0.005 | 0.442 | -0.003 | 0.333 | 0.200 | 0.250 | 2 | 10 | 6 | 1
8.0        | 0.049 | 0.082 | 0.004 | 0.383 | -0.037 | 0.000 | 0.000 | 0.000 | 0 | 10 | 4 | 0
9.0        | 0.184 | 0.053 | 0.000 | 0.552 | -0.189 | 0.000 | 0.000 | 0.000 | 0 | 10 | 1 | 0
10.0        | 0.146 | 0.119 | 0.004 | 0.481 | 0.006 | 0.500 | 0.200 | 0.286 | 2 | 10 | 4 | 1

Control ID: 153
Iteration | cosine_tfidf | rouge_l_f1 | bleu | structural_similarity | bertscore_f1 | precision | recall | f1 | true_positives | gt_count | ai_claims | matched_ai_claims
-------------------------------------------------------------------------------------------------------------------------------------------------------------------------
1.0        | 0.287 | 0.200 | 0.011 | 0.533 | 0.221 | 0.000 | 0.000 | 0.000 | 0 | 3 | 4 | 0
2.0        | 0.297 | 0.094 | 0.003 | 0.445 | -0.033 | 0.000 | 0.000 | 0.000 | 0 | 3 | 13 | 0
3.0        | 0.303 | 0.074 | 0.003 | 0.538 | 0.022 | 0.000 | 0.000 | 0.000 | 0 | 3 | 9 | 0
4.0        | 0.257 | 0.140 | 0.005 | 0.520 | 0.007 | 0.000 | 0.000 | 0.000 | 0 | 3 | 5 | 0
5.0        | 0.309 | 0.144 | 0.005 | 0.513 | 0.095 | 0.000 | 0.000 | 0.000 | 0 | 3 | 4 | 0
6.0        | 0.249 | 0.142 | 0.007 | 0.567 | 0.151 | 0.000 | 0.000 | 0.000 | 0 | 3 | 3 | 0
7.0        | 0.261 | 0.116 | 0.004 | 0.513 | 0.026 | 0.000 | 0.000 | 0.000 | 0 | 3 | 5 | 0
8.0        | 0.280 | 0.157 | 0.006 | 0.524 | 0.129 | 0.000 | 0.000 | 0.000 | 0 | 3 | 4 | 0
9.0        | 0.316 | 0.149 | 0.006 | 0.507 | 0.083 | 0.000 | 0.000 | 0.000 | 0 | 3 | 4 | 0
10.0        | 0.291 | 0.095 | 0.003 | 0.502 | -0.062 | 0.000 | 0.000 | 0.000 | 0 | 3 | 9 | 0

Control ID: 154
Iteration | cosine_tfidf | rouge_l_f1 | bleu | structural_similarity | bertscore_f1 | precision | recall | f1 | true_positives | gt_count | ai_claims | matched_ai_claims
-------------------------------------------------------------------------------------------------------------------------------------------------------------------------
1.0        | 0.328 | 0.186 | 0.010 | 0.534 | 0.019 | 0.000 | 0.000 | 0.000 | 0 | 4 | 5 | 0
2.0        | 0.309 | 0.199 | 0.011 | 0.592 | 0.105 | 0.000 | 0.000 | 0.000 | 0 | 4 | 3 | 0
3.0        | 0.269 | 0.232 | 0.006 | 0.583 | -0.019 | 0.000 | 0.000 | 0.000 | 0 | 4 | 5 | 0
4.0        | 0.288 | 0.169 | 0.010 | 0.501 | 0.006 | 0.000 | 0.000 | 0.000 | 0 | 4 | 5 | 0
5.0        | 0.207 | 0.196 | 0.008 | 0.528 | -0.009 | 0.000 | 0.000 | 0.000 | 0 | 4 | 5 | 0
6.0        | 0.216 | 0.168 | 0.006 | 0.502 | -0.027 | 0.000 | 0.000 | 0.000 | 0 | 4 | 5 | 0
7.0        | 0.177 | 0.156 | 0.006 | 0.524 | -0.029 | 0.000 | 0.000 | 0.000 | 0 | 4 | 5 | 0
8.0        | 0.309 | 0.202 | 0.009 | 0.514 | 0.020 | 0.000 | 0.000 | 0.000 | 0 | 4 | 5 | 0
9.0        | 0.210 | 0.166 | 0.007 | 0.519 | 0.036 | 0.000 | 0.000 | 0.000 | 0 | 4 | 3 | 0
10.0        | 0.294 | 0.159 | 0.018 | 0.513 | 0.010 | 0.000 | 0.000 | 0.000 | 0 | 4 | 6 | 0

====================================================================================================
Per Control Summary (Mean ± Std):
----------------------------------------------------------------------------------------------------
Control ID: 148.0 | Iterations: 10.0
  cosine_tfidf: 0.416 ± 0.030
  rouge_l_f1: 0.207 ± 0.020
  bleu: 0.034 ± 0.009
  structural_similarity: 0.617 ± 0.046
  bertscore_f1: 0.192 ± 0.018
  precision: 0.243 ± 0.196
  recall: 0.100 ± 0.082
  f1: 0.141 ± 0.114
  true_positives: 10
  gt_count: 100
  ai_claims: 38
  matched_ai_claims: 10
----------------------------------------------------------------------------------------------------
Control ID: 149.0 | Iterations: 10.0
  cosine_tfidf: 0.117 ± 0.029
  rouge_l_f1: 0.112 ± 0.022
  bleu: 0.005 ± 0.001
  structural_similarity: 0.380 ± 0.043
  bertscore_f1: -0.054 ± 0.063
  precision: 0.017 ± 0.053
  recall: 0.020 ± 0.063
  f1: 0.018 ± 0.057
  true_positives: 1
  gt_count: 50
  ai_claims: 42
  matched_ai_claims: 1
----------------------------------------------------------------------------------------------------
Control ID: 150.0 | Iterations: 10.0
  cosine_tfidf: 0.302 ± 0.039
  rouge_l_f1: 0.181 ± 0.030
  bleu: 0.020 ± 0.004
  structural_similarity: 0.499 ± 0.035
  bertscore_f1: 0.070 ± 0.039
  precision: 0.000 ± 0.000
  recall: 0.000 ± 0.000
  f1: 0.000 ± 0.000
  true_positives: 0
  gt_count: 40
  ai_claims: 46
  matched_ai_claims: 0
----------------------------------------------------------------------------------------------------
Control ID: 151.0 | Iterations: 10.0
  cosine_tfidf: 0.144 ± 0.046
  rouge_l_f1: 0.145 ± 0.043
  bleu: 0.006 ± 0.004
  structural_similarity: 0.478 ± 0.077
  bertscore_f1: -0.011 ± 0.049
  precision: 0.000 ± 0.000
  recall: 0.000 ± 0.000
  f1: 0.000 ± 0.000
  true_positives: 0
  gt_count: 100
  ai_claims: 41
  matched_ai_claims: 0
----------------------------------------------------------------------------------------------------
Control ID: 152.0 | Iterations: 10.0
  cosine_tfidf: 0.127 ± 0.038
  rouge_l_f1: 0.111 ± 0.029
  bleu: 0.004 ± 0.002
  structural_similarity: 0.467 ± 0.059
  bertscore_f1: -0.027 ± 0.066
  precision: 0.283 ± 0.343
  recall: 0.100 ± 0.105
  f1: 0.144 ± 0.153
  true_positives: 10
  gt_count: 100
  ai_claims: 35
  matched_ai_claims: 5
----------------------------------------------------------------------------------------------------
Control ID: 153.0 | Iterations: 10.0
  cosine_tfidf: 0.285 ± 0.023
  rouge_l_f1: 0.131 ± 0.037
  bleu: 0.005 ± 0.002
  structural_similarity: 0.516 ± 0.031
  bertscore_f1: 0.064 ± 0.088
  precision: 0.000 ± 0.000
  recall: 0.000 ± 0.000
  f1: 0.000 ± 0.000
  true_positives: 0
  gt_count: 30
  ai_claims: 60
  matched_ai_claims: 0
----------------------------------------------------------------------------------------------------
Control ID: 154.0 | Iterations: 10.0
  cosine_tfidf: 0.261 ± 0.053
  rouge_l_f1: 0.183 ± 0.024
  bleu: 0.009 ± 0.004
  structural_similarity: 0.531 ± 0.032
  bertscore_f1: 0.011 ± 0.039
  precision: 0.000 ± 0.000
  recall: 0.000 ± 0.000
  f1: 0.000 ± 0.000
  true_positives: 0
  gt_count: 40
  ai_claims: 47
  matched_ai_claims: 0
----------------------------------------------------------------------------------------------------
