AI Recommendation Robustness and Ground Truth Evaluation Report
====================================================================================================

Per Control Metrics (Iterations as table):
----------------------------------------------------------------------------------------------------
Control ID: 148
Iteration | cosine_tfidf | rouge_l_f1 | bleu | structural_similarity | bertscore_f1 | precision | recall | f1 | true_positives | gt_count | ai_claims | matched_ai_claims
-------------------------------------------------------------------------------------------------------------------------------------------------------------------------
1.0        | 0.394 | 0.195 | 0.025 | 0.589 | 0.117 | 0.200 | 0.083 | 0.118 | 1 | 12 | 5 | 1
2.0        | 0.445 | 0.227 | 0.025 | 0.602 | 0.146 | 0.000 | 0.000 | 0.000 | 0 | 12 | 3 | 0
3.0        | 0.423 | 0.187 | 0.033 | 0.574 | 0.121 | 0.000 | 0.000 | 0.000 | 0 | 12 | 3 | 0
4.0        | 0.437 | 0.167 | 0.048 | 0.590 | 0.135 | 0.000 | 0.000 | 0.000 | 0 | 12 | 3 | 0
5.0        | 0.463 | 0.244 | 0.031 | 0.588 | 0.141 | 0.250 | 0.083 | 0.125 | 1 | 12 | 4 | 1
6.0        | 0.372 | 0.230 | 0.060 | 0.515 | 0.137 | 0.250 | 0.083 | 0.125 | 1 | 12 | 4 | 1
7.0        | 0.345 | 0.200 | 0.036 | 0.575 | 0.109 | 0.000 | 0.000 | 0.000 | 0 | 12 | 3 | 0
8.0        | 0.427 | 0.159 | 0.031 | 0.525 | 0.079 | 0.000 | 0.000 | 0.000 | 0 | 12 | 4 | 0
9.0        | 0.401 | 0.160 | 0.024 | 0.602 | 0.108 | 0.250 | 0.083 | 0.125 | 1 | 12 | 4 | 1
10.0        | 0.467 | 0.194 | 0.040 | 0.616 | 0.097 | 0.250 | 0.083 | 0.125 | 1 | 12 | 4 | 1

Control ID: 149
Iteration | cosine_tfidf | rouge_l_f1 | bleu | structural_similarity | bertscore_f1 | precision | recall | f1 | true_positives | gt_count | ai_claims | matched_ai_claims
-------------------------------------------------------------------------------------------------------------------------------------------------------------------------
1.0        | 0.148 | 0.094 | 0.004 | 0.409 | -0.102 | 0.000 | 0.000 | 0.000 | 0 | 11 | 4 | 0
2.0        | 0.320 | 0.162 | 0.005 | 0.524 | 0.038 | 0.400 | 0.182 | 0.250 | 2 | 11 | 5 | 1
3.0        | 0.220 | 0.115 | 0.006 | 0.420 | -0.047 | 0.000 | 0.000 | 0.000 | 0 | 11 | 4 | 0
4.0        | 0.151 | 0.129 | 0.005 | 0.530 | -0.018 | 0.400 | 0.182 | 0.250 | 2 | 11 | 5 | 1
5.0        | 0.168 | 0.126 | 0.005 | 0.528 | -0.042 | 0.250 | 0.091 | 0.133 | 1 | 11 | 4 | 1
6.0        | 0.240 | 0.118 | 0.010 | 0.531 | -0.053 | 0.500 | 0.182 | 0.267 | 2 | 11 | 4 | 1
7.0        | 0.158 | 0.098 | 0.004 | 0.514 | -0.045 | 0.000 | 0.000 | 0.000 | 0 | 11 | 4 | 0
8.0        | 0.153 | 0.113 | 0.005 | 0.479 | -0.038 | 0.000 | 0.000 | 0.000 | 0 | 11 | 5 | 0
9.0        | 0.172 | 0.152 | 0.005 | 0.555 | -0.031 | 0.250 | 0.091 | 0.133 | 1 | 11 | 4 | 1
10.0        | 0.180 | 0.147 | 0.005 | 0.473 | -0.112 | 0.000 | 0.000 | 0.000 | 0 | 11 | 4 | 0

Control ID: 150
Iteration | cosine_tfidf | rouge_l_f1 | bleu | structural_similarity | bertscore_f1 | precision | recall | f1 | true_positives | gt_count | ai_claims | matched_ai_claims
-------------------------------------------------------------------------------------------------------------------------------------------------------------------------
1.0        | 0.224 | 0.173 | 0.010 | 0.417 | 0.102 | 0.000 | 0.000 | 0.000 | 0 | 3 | 4 | 0
2.0        | 0.251 | 0.149 | 0.009 | 0.399 | -0.003 | 0.000 | 0.000 | 0.000 | 0 | 3 | 4 | 0
3.0        | 0.215 | 0.172 | 0.005 | 0.455 | 0.033 | 0.000 | 0.000 | 0.000 | 0 | 3 | 5 | 0
4.0        | 0.312 | 0.157 | 0.010 | 0.404 | 0.046 | 0.000 | 0.000 | 0.000 | 0 | 3 | 4 | 0
5.0        | 0.276 | 0.149 | 0.011 | 0.458 | 0.073 | 0.000 | 0.000 | 0.000 | 0 | 3 | 6 | 0
6.0        | 0.295 | 0.183 | 0.013 | 0.406 | 0.080 | 0.000 | 0.000 | 0.000 | 0 | 3 | 4 | 0
7.0        | 0.204 | 0.168 | 0.011 | 0.435 | 0.129 | 0.000 | 0.000 | 0.000 | 0 | 3 | 4 | 0
8.0        | 0.281 | 0.149 | 0.011 | 0.423 | 0.081 | 0.000 | 0.000 | 0.000 | 0 | 3 | 4 | 0
9.0        | 0.270 | 0.190 | 0.012 | 0.451 | 0.136 | 0.000 | 0.000 | 0.000 | 0 | 3 | 4 | 0
10.0        | 0.251 | 0.135 | 0.011 | 0.423 | 0.081 | 0.000 | 0.000 | 0.000 | 0 | 3 | 4 | 0

Control ID: 151
Iteration | cosine_tfidf | rouge_l_f1 | bleu | structural_similarity | bertscore_f1 | precision | recall | f1 | true_positives | gt_count | ai_claims | matched_ai_claims
-------------------------------------------------------------------------------------------------------------------------------------------------------------------------
1.0        | 0.238 | 0.149 | 0.005 | 0.540 | -0.084 | 0.000 | 0.000 | 0.000 | 0 | 11 | 7 | 0
2.0        | 0.199 | 0.153 | 0.008 | 0.541 | 0.000 | 0.000 | 0.000 | 0.000 | 0 | 11 | 4 | 0
3.0        | 0.151 | 0.120 | 0.008 | 0.453 | -0.057 | 0.000 | 0.000 | 0.000 | 0 | 11 | 5 | 0
4.0        | 0.159 | 0.163 | 0.009 | 0.526 | -0.037 | 0.000 | 0.000 | 0.000 | 0 | 11 | 5 | 0
5.0        | 0.184 | 0.137 | 0.010 | 0.449 | -0.051 | 0.000 | 0.000 | 0.000 | 0 | 11 | 4 | 0
6.0        | 0.152 | 0.150 | 0.005 | 0.495 | -0.001 | 0.000 | 0.000 | 0.000 | 0 | 11 | 5 | 0
7.0        | 0.197 | 0.176 | 0.010 | 0.486 | -0.050 | 0.000 | 0.000 | 0.000 | 0 | 11 | 5 | 0
8.0        | 0.220 | 0.168 | 0.006 | 0.463 | -0.012 | 0.000 | 0.000 | 0.000 | 0 | 11 | 5 | 0
9.0        | 0.169 | 0.139 | 0.005 | 0.468 | 0.008 | 0.000 | 0.000 | 0.000 | 0 | 11 | 4 | 0
10.0        | 0.143 | 0.133 | 0.005 | 0.494 | -0.067 | 0.000 | 0.000 | 0.000 | 0 | 11 | 6 | 0

Control ID: 152
Iteration | cosine_tfidf | rouge_l_f1 | bleu | structural_similarity | bertscore_f1 | precision | recall | f1 | true_positives | gt_count | ai_claims | matched_ai_claims
-------------------------------------------------------------------------------------------------------------------------------------------------------------------------
1.0        | 0.107 | 0.114 | 0.004 | 0.570 | -0.003 | 0.500 | 0.182 | 0.267 | 2 | 11 | 4 | 1
2.0        | 0.104 | 0.137 | 0.005 | 0.476 | -0.005 | 0.000 | 0.000 | 0.000 | 0 | 11 | 4 | 0
3.0        | 0.409 | 0.242 | 0.005 | 0.577 | 0.120 | 0.333 | 0.182 | 0.235 | 2 | 11 | 6 | 1
4.0        | 0.108 | 0.121 | 0.006 | 0.544 | 0.019 | 0.000 | 0.000 | 0.000 | 0 | 11 | 4 | 0
5.0        | 0.234 | 0.175 | 0.006 | 0.509 | 0.057 | 0.000 | 0.000 | 0.000 | 0 | 11 | 3 | 0
6.0        | 0.129 | 0.116 | 0.005 | 0.574 | 0.039 | 0.500 | 0.182 | 0.267 | 2 | 11 | 4 | 1
7.0        | 0.083 | 0.095 | 0.004 | 0.504 | 0.017 | 0.333 | 0.091 | 0.143 | 1 | 11 | 3 | 1
8.0        | 0.096 | 0.121 | 0.005 | 0.453 | -0.024 | 0.000 | 0.000 | 0.000 | 0 | 11 | 4 | 0
9.0        | 0.069 | 0.133 | 0.005 | 0.534 | 0.004 | 0.333 | 0.091 | 0.143 | 1 | 11 | 3 | 1
10.0        | 0.087 | 0.155 | 0.005 | 0.579 | 0.012 | 0.250 | 0.091 | 0.133 | 1 | 11 | 4 | 1

Control ID: 153
Iteration | cosine_tfidf | rouge_l_f1 | bleu | structural_similarity | bertscore_f1 | precision | recall | f1 | true_positives | gt_count | ai_claims | matched_ai_claims
-------------------------------------------------------------------------------------------------------------------------------------------------------------------------
1.0        | 0.266 | 0.161 | 0.011 | 0.564 | 0.092 | 0.000 | 0.000 | 0.000 | 0 | 2 | 4 | 0
2.0        | 0.188 | 0.117 | 0.009 | 0.611 | 0.163 | 0.000 | 0.000 | 0.000 | 0 | 2 | 4 | 0
3.0        | 0.173 | 0.129 | 0.005 | 0.561 | 0.130 | 0.000 | 0.000 | 0.000 | 0 | 2 | 3 | 0
4.0        | 0.233 | 0.118 | 0.009 | 0.630 | 0.162 | 0.000 | 0.000 | 0.000 | 0 | 2 | 4 | 0
5.0        | 0.221 | 0.128 | 0.009 | 0.536 | 0.146 | 0.000 | 0.000 | 0.000 | 0 | 2 | 4 | 0
6.0        | 0.178 | 0.121 | 0.009 | 0.547 | 0.132 | 0.000 | 0.000 | 0.000 | 0 | 2 | 4 | 0
7.0        | 0.196 | 0.121 | 0.009 | 0.562 | 0.092 | 0.000 | 0.000 | 0.000 | 0 | 2 | 3 | 0
8.0        | 0.203 | 0.127 | 0.008 | 0.540 | 0.077 | 0.000 | 0.000 | 0.000 | 0 | 2 | 5 | 0
9.0        | 0.159 | 0.117 | 0.009 | 0.476 | 0.069 | 0.000 | 0.000 | 0.000 | 0 | 2 | 3 | 0
10.0        | 0.219 | 0.115 | 0.009 | 0.566 | 0.091 | 0.000 | 0.000 | 0.000 | 0 | 2 | 5 | 0

Control ID: 154
Iteration | cosine_tfidf | rouge_l_f1 | bleu | structural_similarity | bertscore_f1 | precision | recall | f1 | true_positives | gt_count | ai_claims | matched_ai_claims
-------------------------------------------------------------------------------------------------------------------------------------------------------------------------
1.0        | 0.215 | 0.100 | 0.005 | 0.456 | -0.100 | 0.000 | 0.000 | 0.000 | 0 | 4 | 16 | 0
2.0        | 0.178 | 0.150 | 0.009 | 0.500 | -0.012 | 0.000 | 0.000 | 0.000 | 0 | 4 | 4 | 0
3.0        | 0.362 | 0.225 | 0.015 | 0.565 | 0.063 | 0.000 | 0.000 | 0.000 | 0 | 4 | 4 | 0
4.0        | 0.167 | 0.160 | 0.007 | 0.362 | 0.046 | 0.000 | 0.000 | 0.000 | 0 | 4 | 4 | 0
5.0        | 0.176 | 0.135 | 0.006 | 0.503 | 0.054 | 0.000 | 0.000 | 0.000 | 0 | 4 | 4 | 0
6.0        | 0.143 | 0.162 | 0.006 | 0.450 | 0.018 | 0.000 | 0.000 | 0.000 | 0 | 4 | 4 | 0
7.0        | 0.201 | 0.182 | 0.007 | 0.503 | 0.011 | 0.000 | 0.000 | 0.000 | 0 | 4 | 3 | 0
8.0        | 0.197 | 0.146 | 0.005 | 0.498 | 0.004 | 0.000 | 0.000 | 0.000 | 0 | 4 | 5 | 0
9.0        | 0.198 | 0.157 | 0.005 | 0.488 | 0.010 | 0.000 | 0.000 | 0.000 | 0 | 4 | 5 | 0
10.0        | 0.284 | 0.172 | 0.009 | 0.469 | -0.034 | 0.000 | 0.000 | 0.000 | 0 | 4 | 5 | 0

====================================================================================================
Per Control Summary (Mean ± Std):
----------------------------------------------------------------------------------------------------
Control ID: 148.0 | Iterations: 10.0
  cosine_tfidf: 0.417 ± 0.040
  rouge_l_f1: 0.196 ± 0.030
  bleu: 0.035 ± 0.011
  structural_similarity: 0.578 ± 0.033
  bertscore_f1: 0.119 ± 0.021
  precision: 0.120 ± 0.127
  recall: 0.042 ± 0.044
  f1: 0.062 ± 0.065
  true_positives: 5
  gt_count: 120
  ai_claims: 37
  matched_ai_claims: 5
----------------------------------------------------------------------------------------------------
Control ID: 149.0 | Iterations: 10.0
  cosine_tfidf: 0.191 ± 0.055
  rouge_l_f1: 0.125 ± 0.023
  bleu: 0.005 ± 0.002
  structural_similarity: 0.496 ± 0.050
  bertscore_f1: -0.045 ± 0.042
  precision: 0.180 ± 0.203
  recall: 0.073 ± 0.084
  f1: 0.103 ± 0.118
  true_positives: 8
  gt_count: 110
  ai_claims: 43
  matched_ai_claims: 5
----------------------------------------------------------------------------------------------------
Control ID: 150.0 | Iterations: 10.0
  cosine_tfidf: 0.258 ± 0.036
  rouge_l_f1: 0.162 ± 0.018
  bleu: 0.010 ± 0.002
  structural_similarity: 0.427 ± 0.022
  bertscore_f1: 0.076 ± 0.042
  precision: 0.000 ± 0.000
  recall: 0.000 ± 0.000
  f1: 0.000 ± 0.000
  true_positives: 0
  gt_count: 30
  ai_claims: 43
  matched_ai_claims: 0
----------------------------------------------------------------------------------------------------
Control ID: 151.0 | Iterations: 10.0
  cosine_tfidf: 0.181 ± 0.032
  rouge_l_f1: 0.149 ± 0.017
  bleu: 0.007 ± 0.002
  structural_similarity: 0.491 ± 0.035
  bertscore_f1: -0.035 ± 0.032
  precision: 0.000 ± 0.000
  recall: 0.000 ± 0.000
  f1: 0.000 ± 0.000
  true_positives: 0
  gt_count: 110
  ai_claims: 50
  matched_ai_claims: 0
----------------------------------------------------------------------------------------------------
Control ID: 152.0 | Iterations: 10.0
  cosine_tfidf: 0.143 ± 0.104
  rouge_l_f1: 0.141 ± 0.042
  bleu: 0.005 ± 0.001
  structural_similarity: 0.532 ± 0.045
  bertscore_f1: 0.024 ± 0.041
  precision: 0.225 ± 0.208
  recall: 0.082 ± 0.080
  f1: 0.119 ± 0.113
  true_positives: 9
  gt_count: 110
  ai_claims: 39
  matched_ai_claims: 6
----------------------------------------------------------------------------------------------------
Control ID: 153.0 | Iterations: 10.0
  cosine_tfidf: 0.204 ± 0.032
  rouge_l_f1: 0.125 ± 0.014
  bleu: 0.009 ± 0.001
  structural_similarity: 0.559 ± 0.042
  bertscore_f1: 0.115 ± 0.035
  precision: 0.000 ± 0.000
  recall: 0.000 ± 0.000
  f1: 0.000 ± 0.000
  true_positives: 0
  gt_count: 20
  ai_claims: 39
  matched_ai_claims: 0
----------------------------------------------------------------------------------------------------
Control ID: 154.0 | Iterations: 10.0
  cosine_tfidf: 0.212 ± 0.065
  rouge_l_f1: 0.159 ± 0.032
  bleu: 0.007 ± 0.003
  structural_similarity: 0.479 ± 0.052
  bertscore_f1: 0.006 ± 0.048
  precision: 0.000 ± 0.000
  recall: 0.000 ± 0.000
  f1: 0.000 ± 0.000
  true_positives: 0
  gt_count: 40
  ai_claims: 54
  matched_ai_claims: 0
----------------------------------------------------------------------------------------------------
