AI Recommendation Robustness and Ground Truth Evaluation Report
====================================================================================================

Per Control Metrics (Iterations as table):
----------------------------------------------------------------------------------------------------
Control ID: 148
Iteration | cosine_tfidf | rouge_l_f1 | bleu | structural_similarity | bertscore_f1 | precision | recall | f1 | true_positives | gt_count | ai_claims | matched_ai_claims
-------------------------------------------------------------------------------------------------------------------------------------------------------------------------
1.0        | 0.414 | 0.196 | 0.028 | 0.621 | 0.177 | 0.200 | 0.100 | 0.133 | 1 | 10 | 5 | 1
2.0        | 0.431 | 0.243 | 0.026 | 0.613 | 0.220 | 0.000 | 0.000 | 0.000 | 0 | 10 | 3 | 0
3.0        | 0.405 | 0.197 | 0.035 | 0.594 | 0.165 | 0.000 | 0.000 | 0.000 | 0 | 10 | 3 | 0
4.0        | 0.437 | 0.196 | 0.064 | 0.619 | 0.210 | 0.000 | 0.000 | 0.000 | 0 | 10 | 3 | 0
5.0        | 0.494 | 0.251 | 0.040 | 0.623 | 0.198 | 0.250 | 0.100 | 0.143 | 1 | 10 | 4 | 1
6.0        | 0.334 | 0.257 | 0.079 | 0.541 | 0.185 | 0.250 | 0.100 | 0.143 | 1 | 10 | 4 | 1
7.0        | 0.379 | 0.223 | 0.048 | 0.603 | 0.177 | 0.000 | 0.000 | 0.000 | 0 | 10 | 3 | 0
8.0        | 0.399 | 0.157 | 0.027 | 0.529 | 0.139 | 0.000 | 0.000 | 0.000 | 0 | 10 | 4 | 0
9.0        | 0.382 | 0.158 | 0.019 | 0.619 | 0.157 | 0.250 | 0.100 | 0.143 | 1 | 10 | 4 | 1
10.0        | 0.445 | 0.195 | 0.050 | 0.633 | 0.168 | 0.250 | 0.100 | 0.143 | 1 | 10 | 4 | 1

Control ID: 149
Iteration | cosine_tfidf | rouge_l_f1 | bleu | structural_similarity | bertscore_f1 | precision | recall | f1 | true_positives | gt_count | ai_claims | matched_ai_claims
-------------------------------------------------------------------------------------------------------------------------------------------------------------------------
1.0        | 0.111 | 0.102 | 0.004 | 0.351 | -0.119 | 0.000 | 0.000 | 0.000 | 0 | 5 | 4 | 0
2.0        | 0.257 | 0.173 | 0.005 | 0.423 | 0.018 | 0.200 | 0.200 | 0.200 | 1 | 5 | 5 | 1
3.0        | 0.160 | 0.105 | 0.006 | 0.293 | -0.113 | 0.000 | 0.000 | 0.000 | 0 | 5 | 4 | 0
4.0        | 0.120 | 0.103 | 0.004 | 0.424 | 0.011 | 0.200 | 0.200 | 0.200 | 1 | 5 | 5 | 1
5.0        | 0.116 | 0.130 | 0.005 | 0.452 | -0.012 | 0.000 | 0.000 | 0.000 | 0 | 5 | 4 | 0
6.0        | 0.247 | 0.164 | 0.012 | 0.442 | -0.019 | 0.250 | 0.200 | 0.222 | 1 | 5 | 4 | 1
7.0        | 0.119 | 0.106 | 0.004 | 0.432 | -0.041 | 0.000 | 0.000 | 0.000 | 0 | 5 | 4 | 0
8.0        | 0.115 | 0.115 | 0.005 | 0.393 | -0.039 | 0.000 | 0.000 | 0.000 | 0 | 5 | 5 | 0
9.0        | 0.104 | 0.128 | 0.006 | 0.408 | -0.032 | 0.000 | 0.000 | 0.000 | 0 | 5 | 4 | 0
10.0        | 0.135 | 0.120 | 0.006 | 0.358 | -0.196 | 0.000 | 0.000 | 0.000 | 0 | 5 | 4 | 0

Control ID: 150
Iteration | cosine_tfidf | rouge_l_f1 | bleu | structural_similarity | bertscore_f1 | precision | recall | f1 | true_positives | gt_count | ai_claims | matched_ai_claims
-------------------------------------------------------------------------------------------------------------------------------------------------------------------------
1.0        | 0.243 | 0.204 | 0.019 | 0.457 | 0.103 | 0.000 | 0.000 | 0.000 | 0 | 4 | 4 | 0
2.0        | 0.317 | 0.198 | 0.015 | 0.506 | 0.028 | 0.000 | 0.000 | 0.000 | 0 | 4 | 4 | 0
3.0        | 0.266 | 0.200 | 0.009 | 0.502 | 0.051 | 0.000 | 0.000 | 0.000 | 0 | 4 | 5 | 0
4.0        | 0.330 | 0.147 | 0.017 | 0.451 | 0.054 | 0.000 | 0.000 | 0.000 | 0 | 4 | 4 | 0
5.0        | 0.319 | 0.209 | 0.015 | 0.530 | 0.087 | 0.000 | 0.000 | 0.000 | 0 | 4 | 6 | 0
6.0        | 0.339 | 0.213 | 0.022 | 0.529 | 0.102 | 0.000 | 0.000 | 0.000 | 0 | 4 | 4 | 0
7.0        | 0.233 | 0.188 | 0.020 | 0.480 | 0.148 | 0.000 | 0.000 | 0.000 | 0 | 4 | 4 | 0
8.0        | 0.297 | 0.207 | 0.019 | 0.538 | 0.107 | 0.000 | 0.000 | 0.000 | 0 | 4 | 4 | 0
9.0        | 0.334 | 0.224 | 0.024 | 0.530 | 0.155 | 0.000 | 0.000 | 0.000 | 0 | 4 | 4 | 0
10.0        | 0.269 | 0.179 | 0.018 | 0.505 | 0.117 | 0.000 | 0.000 | 0.000 | 0 | 4 | 4 | 0

Control ID: 151
Iteration | cosine_tfidf | rouge_l_f1 | bleu | structural_similarity | bertscore_f1 | precision | recall | f1 | true_positives | gt_count | ai_claims | matched_ai_claims
-------------------------------------------------------------------------------------------------------------------------------------------------------------------------
1.0        | 0.226 | 0.152 | 0.004 | 0.560 | -0.079 | 0.000 | 0.000 | 0.000 | 0 | 10 | 7 | 0
2.0        | 0.198 | 0.169 | 0.010 | 0.571 | 0.017 | 0.000 | 0.000 | 0.000 | 0 | 10 | 4 | 0
3.0        | 0.142 | 0.120 | 0.008 | 0.474 | -0.046 | 0.000 | 0.000 | 0.000 | 0 | 10 | 5 | 0
4.0        | 0.141 | 0.159 | 0.008 | 0.542 | -0.029 | 0.000 | 0.000 | 0.000 | 0 | 10 | 5 | 0
5.0        | 0.179 | 0.139 | 0.010 | 0.470 | -0.052 | 0.000 | 0.000 | 0.000 | 0 | 10 | 4 | 0
6.0        | 0.148 | 0.174 | 0.006 | 0.511 | 0.009 | 0.000 | 0.000 | 0.000 | 0 | 10 | 5 | 0
7.0        | 0.166 | 0.165 | 0.010 | 0.493 | -0.043 | 0.000 | 0.000 | 0.000 | 0 | 10 | 5 | 0
8.0        | 0.205 | 0.172 | 0.006 | 0.482 | -0.005 | 0.000 | 0.000 | 0.000 | 0 | 10 | 5 | 0
9.0        | 0.159 | 0.142 | 0.006 | 0.488 | 0.011 | 0.000 | 0.000 | 0.000 | 0 | 10 | 4 | 0
10.0        | 0.147 | 0.134 | 0.005 | 0.521 | -0.053 | 0.000 | 0.000 | 0.000 | 0 | 10 | 6 | 0

Control ID: 152
Iteration | cosine_tfidf | rouge_l_f1 | bleu | structural_similarity | bertscore_f1 | precision | recall | f1 | true_positives | gt_count | ai_claims | matched_ai_claims
-------------------------------------------------------------------------------------------------------------------------------------------------------------------------
1.0        | 0.110 | 0.114 | 0.004 | 0.520 | -0.010 | 0.500 | 0.200 | 0.286 | 2 | 10 | 4 | 1
2.0        | 0.110 | 0.156 | 0.005 | 0.444 | -0.010 | 0.000 | 0.000 | 0.000 | 0 | 10 | 4 | 0
3.0        | 0.525 | 0.292 | 0.023 | 0.535 | 0.146 | 0.500 | 0.300 | 0.375 | 3 | 10 | 6 | 2
4.0        | 0.160 | 0.140 | 0.006 | 0.498 | 0.025 | 0.000 | 0.000 | 0.000 | 0 | 10 | 4 | 0
5.0        | 0.322 | 0.215 | 0.005 | 0.473 | 0.072 | 0.333 | 0.100 | 0.154 | 1 | 10 | 3 | 1
6.0        | 0.183 | 0.138 | 0.004 | 0.556 | 0.035 | 0.500 | 0.200 | 0.286 | 2 | 10 | 4 | 1
7.0        | 0.089 | 0.097 | 0.003 | 0.458 | 0.005 | 0.667 | 0.200 | 0.308 | 2 | 10 | 3 | 1
8.0        | 0.150 | 0.161 | 0.009 | 0.430 | 0.001 | 0.000 | 0.000 | 0.000 | 0 | 10 | 4 | 0
9.0        | 0.144 | 0.162 | 0.005 | 0.500 | 0.021 | 0.667 | 0.200 | 0.308 | 2 | 10 | 3 | 1
10.0        | 0.130 | 0.162 | 0.005 | 0.538 | 0.010 | 0.500 | 0.200 | 0.286 | 2 | 10 | 4 | 1

Control ID: 153
Iteration | cosine_tfidf | rouge_l_f1 | bleu | structural_similarity | bertscore_f1 | precision | recall | f1 | true_positives | gt_count | ai_claims | matched_ai_claims
-------------------------------------------------------------------------------------------------------------------------------------------------------------------------
1.0        | 0.278 | 0.154 | 0.007 | 0.537 | 0.036 | 0.000 | 0.000 | 0.000 | 0 | 3 | 4 | 0
2.0        | 0.226 | 0.140 | 0.006 | 0.547 | 0.100 | 0.000 | 0.000 | 0.000 | 0 | 3 | 4 | 0
3.0        | 0.331 | 0.154 | 0.006 | 0.563 | 0.147 | 0.000 | 0.000 | 0.000 | 0 | 3 | 3 | 0
4.0        | 0.348 | 0.155 | 0.010 | 0.615 | 0.176 | 0.000 | 0.000 | 0.000 | 0 | 3 | 4 | 0
5.0        | 0.286 | 0.150 | 0.009 | 0.540 | 0.146 | 0.000 | 0.000 | 0.000 | 0 | 3 | 4 | 0
6.0        | 0.246 | 0.145 | 0.006 | 0.486 | 0.073 | 0.000 | 0.000 | 0.000 | 0 | 3 | 4 | 0
7.0        | 0.315 | 0.168 | 0.010 | 0.563 | 0.169 | 0.000 | 0.000 | 0.000 | 0 | 3 | 3 | 0
8.0        | 0.263 | 0.135 | 0.005 | 0.498 | 0.077 | 0.000 | 0.000 | 0.000 | 0 | 3 | 5 | 0
9.0        | 0.255 | 0.140 | 0.009 | 0.513 | 0.062 | 0.000 | 0.000 | 0.000 | 0 | 3 | 3 | 0
10.0        | 0.223 | 0.110 | 0.005 | 0.539 | 0.055 | 0.000 | 0.000 | 0.000 | 0 | 3 | 5 | 0

Control ID: 154
Iteration | cosine_tfidf | rouge_l_f1 | bleu | structural_similarity | bertscore_f1 | precision | recall | f1 | true_positives | gt_count | ai_claims | matched_ai_claims
-------------------------------------------------------------------------------------------------------------------------------------------------------------------------
1.0        | 0.287 | 0.149 | 0.005 | 0.491 | -0.109 | 0.000 | 0.000 | 0.000 | 0 | 4 | 16 | 0
2.0        | 0.251 | 0.219 | 0.009 | 0.545 | 0.007 | 0.000 | 0.000 | 0.000 | 0 | 4 | 4 | 0
3.0        | 0.428 | 0.242 | 0.013 | 0.579 | 0.072 | 0.000 | 0.000 | 0.000 | 0 | 4 | 4 | 0
4.0        | 0.220 | 0.189 | 0.007 | 0.415 | 0.007 | 0.000 | 0.000 | 0.000 | 0 | 4 | 4 | 0
5.0        | 0.223 | 0.140 | 0.006 | 0.479 | -0.006 | 0.000 | 0.000 | 0.000 | 0 | 4 | 4 | 0
6.0        | 0.199 | 0.176 | 0.007 | 0.512 | 0.020 | 0.000 | 0.000 | 0.000 | 0 | 4 | 4 | 0
7.0        | 0.268 | 0.217 | 0.007 | 0.575 | -0.009 | 0.000 | 0.000 | 0.000 | 0 | 4 | 3 | 0
8.0        | 0.287 | 0.203 | 0.005 | 0.545 | -0.013 | 0.000 | 0.000 | 0.000 | 0 | 4 | 5 | 0
9.0        | 0.268 | 0.189 | 0.005 | 0.512 | -0.003 | 0.000 | 0.000 | 0.000 | 0 | 4 | 5 | 0
10.0        | 0.384 | 0.223 | 0.009 | 0.528 | 0.009 | 0.000 | 0.000 | 0.000 | 0 | 4 | 5 | 0

====================================================================================================
Per Control Summary (Mean ± Std):
----------------------------------------------------------------------------------------------------
Control ID: 148.0 | Iterations: 10.0
  cosine_tfidf: 0.412 ± 0.043
  rouge_l_f1: 0.207 ± 0.036
  bleu: 0.042 ± 0.019
  structural_similarity: 0.600 ± 0.036
  bertscore_f1: 0.180 ± 0.025
  precision: 0.120 ± 0.127
  recall: 0.050 ± 0.053
  f1: 0.070 ± 0.074
  true_positives: 5
  gt_count: 100
  ai_claims: 37
  matched_ai_claims: 5
----------------------------------------------------------------------------------------------------
Control ID: 149.0 | Iterations: 10.0
  cosine_tfidf: 0.148 ± 0.057
  rouge_l_f1: 0.125 ± 0.025
  bleu: 0.006 ± 0.002
  structural_similarity: 0.398 ± 0.050
  bertscore_f1: -0.054 ± 0.068
  precision: 0.065 ± 0.106
  recall: 0.060 ± 0.097
  f1: 0.062 ± 0.100
  true_positives: 3
  gt_count: 50
  ai_claims: 43
  matched_ai_claims: 3
----------------------------------------------------------------------------------------------------
Control ID: 150.0 | Iterations: 10.0
  cosine_tfidf: 0.295 ± 0.039
  rouge_l_f1: 0.197 ± 0.022
  bleu: 0.018 ± 0.004
  structural_similarity: 0.503 ± 0.031
  bertscore_f1: 0.095 ± 0.041
  precision: 0.000 ± 0.000
  recall: 0.000 ± 0.000
  f1: 0.000 ± 0.000
  true_positives: 0
  gt_count: 40
  ai_claims: 43
  matched_ai_claims: 0
----------------------------------------------------------------------------------------------------
Control ID: 151.0 | Iterations: 10.0
  cosine_tfidf: 0.171 ± 0.030
  rouge_l_f1: 0.153 ± 0.018
  bleu: 0.007 ± 0.002
  structural_similarity: 0.511 ± 0.036
  bertscore_f1: -0.027 ± 0.033
  precision: 0.000 ± 0.000
  recall: 0.000 ± 0.000
  f1: 0.000 ± 0.000
  true_positives: 0
  gt_count: 100
  ai_claims: 50
  matched_ai_claims: 0
----------------------------------------------------------------------------------------------------
Control ID: 152.0 | Iterations: 10.0
  cosine_tfidf: 0.192 ± 0.134
  rouge_l_f1: 0.164 ± 0.055
  bleu: 0.007 ± 0.006
  structural_similarity: 0.495 ± 0.043
  bertscore_f1: 0.030 ± 0.048
  precision: 0.367 ± 0.270
  recall: 0.140 ± 0.107
  f1: 0.200 ± 0.148
  true_positives: 14
  gt_count: 100
  ai_claims: 39
  matched_ai_claims: 8
----------------------------------------------------------------------------------------------------
Control ID: 153.0 | Iterations: 10.0
  cosine_tfidf: 0.277 ± 0.043
  rouge_l_f1: 0.145 ± 0.015
  bleu: 0.007 ± 0.002
  structural_similarity: 0.540 ± 0.037
  bertscore_f1: 0.104 ± 0.051
  precision: 0.000 ± 0.000
  recall: 0.000 ± 0.000
  f1: 0.000 ± 0.000
  true_positives: 0
  gt_count: 30
  ai_claims: 39
  matched_ai_claims: 0
----------------------------------------------------------------------------------------------------
Control ID: 154.0 | Iterations: 10.0
  cosine_tfidf: 0.282 ± 0.073
  rouge_l_f1: 0.195 ± 0.033
  bleu: 0.007 ± 0.002
  structural_similarity: 0.518 ± 0.049
  bertscore_f1: -0.003 ± 0.045
  precision: 0.000 ± 0.000
  recall: 0.000 ± 0.000
  f1: 0.000 ± 0.000
  true_positives: 0
  gt_count: 40
  ai_claims: 54
  matched_ai_claims: 0
----------------------------------------------------------------------------------------------------
